{
  "kind": "moc",
  "spec_version": "0.1",
  "id": "company-operations-starter",
  "status": "example",
  "authority": "navigation_only",
  "title": "Company Operations Starter",
  "refs": [
    "kotodama-company-starter",
    "source-intake-starter",
    "intent-candidate-starter",
    "human-decision-starter",
    "work-order-starter",
    "verification-receipt-starter",
    "promotion-gate-starter"
  ]
}
